<?xml version="1.0"?>
<!--
/**
 * @author Amasty Team
 * @copyright Copyright (c) 2021 Amasty (https://www.amasty.com)
 * @package Amasty_Rma
 */
-->

<config xmlns:xsi="http://www.w3.org/2001/XMLSchema-instance" xsi:noNamespaceSchemaLocation="urn:amasty:module:Amasty_ExportCore:etc/am_export.xsd">
    <entity code="amasty_rma_chat">
        <name>Amasty RMA Chat</name>
        <group>Amasty RMA</group>
        <collectionFactory class="Amasty\Rma\Model\Chat\ResourceModel\CollectionFactory"/>
        <fieldsConfig>
            <fieldsClass class="Amasty\ExportCore\Export\FieldsClass\Describe"/>
            <fields>
                <field name="manager_id" />
                <field name="is_system">
                    <filter>
                        <type>toggle</type>
                    </filter>
                </field>
                <field name="is_manager">
                    <filter>
                        <type>toggle</type>
                    </filter>
                </field>
                <field name="is_read">
                    <filter>
                        <type>toggle</type>
                    </filter>
                </field>
            </fields>
        </fieldsConfig>
    </entity>
    <relation code="rma_request_chat">
        <parent_entity>amasty_rma_request</parent_entity>
        <child_entity>amasty_rma_chat</child_entity>
        <sub_entity_field_name>amasty_rma_chat</sub_entity_field_name>
        <type>one_to_many</type>
        <arguments>
            <argument name="parent_field_name" xsi:type="string">request_id</argument>
            <argument name="child_field_name" xsi:type="string">request_id</argument>
        </arguments>
    </relation>
    <relation code="rma_chat_request">
        <parent_entity>amasty_rma_chat</parent_entity>
        <child_entity>amasty_rma_request</child_entity>
        <sub_entity_field_name>amasty_rma_request</sub_entity_field_name>
        <type>one_to_many</type>
        <arguments>
            <argument name="parent_field_name" xsi:type="string">request_id</argument>
            <argument name="child_field_name" xsi:type="string">request_id</argument>
        </arguments>
    </relation>
</config>
